{
  "data_version": "v0.1.1-data",
  "generated_at": "2026-09-21T22:00:00Z",
  "is_mock": true,
  "last_completed_race": {
    "race_id": 1182,
    "season": 2026,
    "round": 14,
    "name": "Spanish Grand Prix",
    "slug": "spanish-grand-prix",
    "circuit_id": 81,
    "starts_at": "2026-09-13T13:00:00Z"
  },
  "next_race": {
    "race_id": 1183,
    "season": 2026,
    "round": 15,
    "name": "Azerbaijan Grand Prix",
    "slug": "azerbaijan-grand-prix",
    "circuit_id": 73,
    "starts_at": "2026-09-26T11:00:00Z",
    "sessions": [
      {
        "name": "Practice 1",
        "starts_at": "2026-09-24T09:30:00Z"
      },
      {
        "name": "Practice 2",
        "starts_at": "2026-09-24T13:00:00Z"
      },
      {
        "name": "Practice 3",
        "starts_at": "2026-09-25T09:30:00Z"
      },
      {
        "name": "Qualifying",
        "starts_at": "2026-09-25T13:00:00Z"
      },
      {
        "name": "Race",
        "starts_at": "2026-09-26T11:00:00Z"
      }
    ]
  }
}
